{
  "pattern_ulid": "01KSB9Y1W8CGKJ3542MFYSNK21",
  "pattern_name": "Bright Minimalist High Key",
  "pattern_slug": "bright_minimalist_high_key",
  "schema_version": 1,
  "description": "Intentionally overexposed or near-overexposed lighting that creates a clean, almost ethereal brightness. Whites bloom slightly; shadows are very light or absent. Associated with clinical beauty, wellness, and luxury skincare brands.",
  "observed_in_sectors": [
    "beauty",
    "retail"
  ],
  "observed_in_account_count": 14,
  "structural_recipe": "Large diffusion overhead (frame/fly diffusion or massive softbox) combined with white floor and background for total light wrap. Slight intentional overexposure (½-1 stop above metered exposure). Product or talent floats in white space with minimal shadow. Often combined with pastel color accents for brand identity markers.",
  "why_it_works": "High-key brightness signals purity, cleanliness, and clinical precision — values that resonate strongly in beauty and wellness. In the beauty sector, it communicates product efficacy through aesthetic cleanliness. Opposite of the amber/candlelit warmth spectrum — deliberately cool and clinical.",
  "transplantation_caveats": [
    "Skin tones can blow out at extreme high-key — requires careful exposure control for talent.",
    "Products with subtle color or texture details can be washed out — test before committing.",
    "Conflict with Saudi heritage warmth aesthetic — avoid for heritage-positioned brands."
  ],
  "applicable_chains": [
    "all"
  ],
  "avg_engagement_multiplier_observed": "1.2x-1.5x",
  "cultural_constraints": [],
  "provenance": {
    "source": "corpus_synthesis_474_obs — corpus_mining_pass May 2026",
    "date_added": "2026-05-24T00:00:00Z",
    "confirmer": "corpus_mining_pass",
    "confidence": "experimental",
    "scope": "sector:beauty+sector:retail"
  }
}